{
  "$schema": "https://json-schema.org/draft/2020-12/schema",
  "$id": "https://ledgercore.io/contracts/schemas/policy-decision-response.v1.schema.json",
  "title": "PolicyDecisionResponse",
  "description": "A policy decision. Only a well-formed response with decision APPROVED may allow a journal to proceed to APPROVED; every other outcome, including a malformed response, keeps the journal out of POSTED.",
  "type": "object",
  "additionalProperties": false,
  "required": [
    "contractVersion",
    "decisionId",
    "transactionId",
    "policyVersion",
    "decision",
    "reasonCodes",
    "evaluatedAt"
  ],
  "properties": {
    "contractVersion": {
      "type": "string",
      "pattern": "^1\\.\\d+\\.\\d+$"
    },
    "decisionId": {
      "description": "Policy-service identifier of this decision; the ledger stores it on the journal for audit.",
      "type": "string",
      "format": "uuid"
    },
    "transactionId": {
      "description": "Echo of the request's transactionId. The ledger rejects a response whose transactionId does not match (treated as contract incompatibility).",
      "type": "string",
      "format": "uuid"
    },
    "policyVersion": {
      "description": "Identifier of the exact policy version evaluated, e.g. 'default-limits@7'. Opaque to the ledger; recorded for traceability.",
      "type": "string",
      "minLength": 1,
      "maxLength": 128
    },
    "decision": {
      "type": "string",
      "enum": ["APPROVED", "REJECTED", "REVIEW_REQUIRED"]
    },
    "reasonCodes": {
      "description": "Machine-readable reasons. Empty only when decision is APPROVED.",
      "type": "array",
      "maxItems": 50,
      "uniqueItems": true,
      "items": {
        "type": "string",
        "pattern": "^[A-Z][A-Z0-9_]{1,63}$"
      }
    },
    "evaluatedAt": {
      "type": "string",
      "format": "date-time"
    }
  },
  "if": {
    "properties": { "decision": { "enum": ["REJECTED", "REVIEW_REQUIRED"] } }
  },
  "then": {
    "properties": { "reasonCodes": { "type": "array", "minItems": 1 } }
  }
}
